{
  "metadata": {
    "week": 17,
    "startDate": "2026-03-28",
    "generatedBy": "tubby",
    "generatedAt": "2026-03-27T02:33:00.000Z"
  },
  "week": 17,
  "year": 2026,
  "startDate": "2026-03-28",
  "endDate": "2026-04-03",
  "days": [
    {
      "day": "Saturday",
      "date": "2026-03-28",
      "breakfast": {
        "name": "Jason's Blended Smoothie / Penny's Overnight Oats + Baked Strawberries",
        "jason": {
          "calories": 572,
          "protein": 54,
          "carbs": 42,
          "fat": 20
        },
        "penny": {
          "calories": 380,
          "protein": 35,
          "carbs": 45,
          "fat": 7
        },
        "ingredients": [
          {
            "name": "Banana",
            "amount": "3 (2 J, 1 P)",
            "category": "Produce"
          },
          {
            "name": "Protein powder (vanilla)",
            "amount": "2 scoops",
            "category": "Pantry"
          },
          {
            "name": "High-protein milk",
            "amount": "400ml",
            "category": "Drinks"
          },
          {
            "name": "Greek yogurt (Chobani)",
            "amount": "350g",
            "category": "Dairy & Eggs"
          },
          {
            "name": "Rolled oats",
            "amount": "60g (Penny)",
            "category": "Pantry"
          },
          {
            "name": "Chia seeds",
            "amount": "1 tbsp (Penny)",
            "category": "Pantry"
          },
          {
            "name": "Strawberries / frozen berries",
            "amount": "400g (bake for Penny)",
            "category": "Frozen"
          }
        ]
      },
      "lunch": {
        "name": "Chicken Savoury Mince + Brown Rice (from freezer)",
        "jason": {
          "calories": 505,
          "protein": 46,
          "carbs": 40,
          "fat": 12
        },
        "penny": {
          "calories": 395,
          "protein": 36,
          "carbs": 32,
          "fat": 10
        },
        "ingredients": [
          {
            "name": "Chicken savoury mince (frozen)",
            "amount": "450g total (250g J, 200g P)",
            "category": "Meat & Seafood"
          },
          {
            "name": "Brown rice",
            "amount": "180g cooked (100g J, 80g P)",
            "category": "Pantry"
          },
          {
            "name": "Onion",
            "amount": "1 (in batch)",
            "category": "Produce"
          },
          {
            "name": "Garlic",
            "amount": "2 cloves (in batch)",
            "category": "Produce"
          },
          {
            "name": "Carrot",
            "amount": "1 (in batch)",
            "category": "Produce"
          },
          {
            "name": "Celery",
            "amount": "2 stalks (in batch)",
            "category": "Produce"
          },
          {
            "name": "Chicken stock",
            "amount": "1 cup (in batch)",
            "category": "Pantry"
          },
          {
            "name": "Mixed herbs",
            "amount": "1 tsp (in batch)",
            "category": "Pantry"
          }
        ]
      },
      "dinner": {
        "name": "Fish & Prawn Marinara + Brown Rice",
        "jason": {
          "calories": 515,
          "protein": 55,
          "carbs": 40,
          "fat": 10
        },
        "penny": {
          "calories": 365,
          "protein": 40,
          "carbs": 28,
          "fat": 7
        },
        "ingredients": [
          {
            "name": "Prawns (cooked & shelled)",
            "amount": "400g (250g J, 150g P)",
            "category": "Meat & Seafood"
          },
          {
            "name": "Barramundi fillets",
            "amount": "100g (60g J, 40g P)",
            "category": "Meat & Seafood"
          },
          {
            "name": "Tomato passata / marinara sauce",
            "amount": "400g jar",
            "category": "Pantry"
          },
          {
            "name": "Brown rice",
            "amount": "250g (150g J, 100g P)",
            "category": "Pantry"
          },
          {
            "name": "Garlic",
            "amount": "2 cloves",
            "category": "Produce"
          },
          {
            "name": "Fresh basil",
            "amount": "handful",
            "category": "Produce"
          },
          {
            "name": "Olive oil",
            "amount": "1 tbsp",
            "category": "Pantry"
          },
          {
            "name": "Lemon",
            "amount": "1/2",
            "category": "Produce"
          }
        ]
      },
      "snacks": {
        "name": "None planned",
        "jason": {
          "calories": 0,
          "protein": 0,
          "carbs": 0,
          "fat": 0
        },
        "penny": {
          "calories": 0,
          "protein": 0,
          "carbs": 0,
          "fat": 0
        },
        "ingredients": []
      },
      "jasonTotal": {
        "calories": 1592,
        "protein": 155,
        "carbs": 122,
        "fat": 42
      },
      "pennyTotal": {
        "calories": 1140,
        "protein": 111,
        "carbs": 105,
        "fat": 24
      }
    },
    {
      "day": "Sunday",
      "date": "2026-03-29",
      "breakfast": {
        "name": "Jason's Blended Smoothie / Penny's Overnight Oats + Baked Strawberries",
        "jason": {
          "calories": 572,
          "protein": 54,
          "carbs": 42,
          "fat": 20
        },
        "penny": {
          "calories": 380,
          "protein": 35,
          "carbs": 45,
          "fat": 7
        },
        "ingredients": [
          {
            "name": "Banana",
            "amount": "3 (2 J, 1 P)",
            "category": "Produce"
          },
          {
            "name": "Protein powder (vanilla)",
            "amount": "2 scoops",
            "category": "Pantry"
          },
          {
            "name": "High-protein milk",
            "amount": "400ml",
            "category": "Drinks"
          },
          {
            "name": "Greek yogurt (Chobani)",
            "amount": "350g",
            "category": "Dairy & Eggs"
          },
          {
            "name": "Rolled oats",
            "amount": "60g (Penny)",
            "category": "Pantry"
          },
          {
            "name": "Chia seeds",
            "amount": "1 tbsp (Penny)",
            "category": "Pantry"
          },
          {
            "name": "Strawberries / frozen berries",
            "amount": "80g (Penny)",
            "category": "Frozen"
          }
        ]
      },
      "lunch": {
        "name": "Chicken Thighs + Salad",
        "jason": {
          "calories": 450,
          "protein": 50,
          "carbs": 8,
          "fat": 22
        },
        "penny": {
          "calories": 300,
          "protein": 33,
          "carbs": 6,
          "fat": 15
        },
        "notes": "Batch cook day \u2014 3kg chicken mince going on after lunch!",
        "ingredients": [
          {
            "name": "Chicken thighs (boneless, skinless)",
            "amount": "330g (200g J, 130g P)",
            "category": "Meat & Seafood"
          },
          {
            "name": "Rocket / spinach",
            "amount": "100g",
            "category": "Produce"
          },
          {
            "name": "Tomatoes",
            "amount": "150g",
            "category": "Produce"
          },
          {
            "name": "Cucumber",
            "amount": "100g",
            "category": "Produce"
          },
          {
            "name": "Red onion",
            "amount": "1/4",
            "category": "Produce"
          },
          {
            "name": "Olive oil",
            "amount": "1 tbsp",
            "category": "Pantry"
          },
          {
            "name": "Lemon",
            "amount": "1/2",
            "category": "Produce"
          }
        ]
      },
      "dinner": {
        "name": "Red Curry Chicken + Mushrooms + Brown Rice",
        "jason": {
          "calories": 720,
          "protein": 55,
          "carbs": 58,
          "fat": 28
        },
        "penny": {
          "calories": 480,
          "protein": 38,
          "carbs": 42,
          "fat": 18
        },
        "ingredients": [
          {
            "name": "Chicken thighs (boneless, skinless)",
            "amount": "330g (200g J, 130g P)",
            "category": "Meat & Seafood"
          },
          {
            "name": "Red curry paste",
            "amount": "2 tbsp",
            "category": "Pantry"
          },
          {
            "name": "Coconut milk",
            "amount": "400ml (1 can)",
            "category": "Pantry"
          },
          {
            "name": "Mushrooms",
            "amount": "250g (150g J, 100g P)",
            "category": "Produce"
          },
          {
            "name": "Brown rice",
            "amount": "250g (150g J, 100g P)",
            "category": "Pantry"
          },
          {
            "name": "Garlic",
            "amount": "2 cloves",
            "category": "Produce"
          }
        ]
      },
      "snacks": {
        "name": "None planned",
        "jason": {
          "calories": 0,
          "protein": 0,
          "carbs": 0,
          "fat": 0
        },
        "penny": {
          "calories": 0,
          "protein": 0,
          "carbs": 0,
          "fat": 0
        },
        "ingredients": []
      },
      "jasonTotal": {
        "calories": 1742,
        "protein": 159,
        "carbs": 108,
        "fat": 70
      },
      "pennyTotal": {
        "calories": 1160,
        "protein": 106,
        "carbs": 93,
        "fat": 40
      }
    },
    {
      "day": "Monday",
      "date": "2026-03-30",
      "breakfast": {
        "name": "Jason's Blended Smoothie / Penny's Overnight Oats",
        "jason": {
          "calories": 572,
          "protein": 54,
          "carbs": 42,
          "fat": 20
        },
        "penny": {